{"kind":"DomainDesignCurrent","layer":"Current","explorationArtifactRef":"artifact:domain_design_support_issue_exploration","domainModel":{"scope":{"application":"客户支持门户","scenario":"提交并追踪支持问题","actor":"客户门户用户","outcome":"问题被解决，或在可见进度下重新打开"},"boundedContexts":[{"contextId":"issue_intake","name":"问题受理","ownedObjects":["support_issue","EvidencePackage","EvidenceReadiness"],"classification":"core","modelRole":"command_model","boundaries":["Owns the customer-submitted issue intake fact before support ownership is assigned.","Owns evidence package readiness for intake submission.","Does not own support assignment, resolution decision, SLA visibility policy, or notification delivery."],"ubiquitousLanguage":[{"term":"证据就绪度","meaning":"已上传证据是否足以进入分诊。"},{"term":"支持问题","meaning":"客户提交并追踪的问题记录；后续支持工单只引用它，不直接修改受理事实。"}],"mission":"在分配支持负责人前捕获客户提交的问题和证据就绪状态。"},{"contextId":"support_case","name":"支持工单","ownedObjects":["support_case","resolution_feedback","case_routing_policy"],"classification":"core","modelRole":"command_model","boundaries":["Owns support case lifecycle after an issue is submitted.","Owns assignment, evidence request, resolution proposal, and reopen acceptance.","Does not own customer-facing timeline projection or notification delivery.","Owns resolution feedback and routing policy as separate aggregates inside the same context; they do not share internal state with SupportCase."],"ubiquitousLanguage":[{"term":"支持工单","meaning":"支持团队处理已提交支持问题的生命周期记录。"},{"term":"解决方案","meaning":"支持团队提出并等待客户确认的问题解决结果。"}],"mission":"负责工单生命周期、支持分配、解决和重新打开决策。"},{"contextId":"status_timeline","name":"状态时间线","ownedObjects":["StatusTimeline"],"classification":"supporting","modelRole":"projection","readModels":["StatusTimeline"],"boundaries":["Owns customer-visible timeline projection assembled from published domain events.","Does not own support case lifecycle truth, issue intake truth, notification delivery, or SLA policy decisions."],"ubiquitousLanguage":[{"term":"状态时间线","meaning":"客户可见的进度、下一步动作、负责人显示和历史事件投影视图。"}],"mission":"向客户投射可见进度、负责人、下一步动作和里程碑历史。"},{"contextId":"notification","name":"通知","ownedObjects":["NotificationRequest"],"classification":"supporting","modelRole":"process_manager","boundaries":["Owns notification request preparation and delivery state.","Consumes issue, case, and policy events but does not decide case status or SLA visibility."],"ubiquitousLanguage":[{"term":"通知请求","meaning":"由领域事件触发、面向客户的更新投递请求。"}],"mission":"在工单或时间线发生重要变化时通知客户。"},{"contextId":"policy_sla","name":"策略与 SLA","ownedObjects":["SlaPolicy"],"classification":"supporting","modelRole":"policy_model","boundaries":["Owns customer-visible SLA and escalation eligibility evaluation.","Does not own support case lifecycle changes; it publishes policy facts consumed by timeline and notification contexts."],"ubiquitousLanguage":[{"term":"SLA 可见性","meaning":"在策略允许范围内向客户展示队列、预计更新时间和升级资格。"}],"mission":"评估支持策略、SLA 可见性、升级资格和重新打开规则。"}],"aggregates":[{"aggregateId":"support_issue","name":"支持问题","contextId":"issue_intake","domainObjects":[{"objectId":"SupportIssue","name":"支持问题","objectType":"aggregate_root","description":"客户提交的问题描述和受理状态。","identityPolicy":"supportIssueId 是外部引用和命令目标；其他上下文只能引用该 ID。","lifecycleOwnership":"由 support_issue 聚合根拥有。","attributes":["supportIssueId","description","category","intakeStatus","evidencePackageId"],"behaviors":["acceptSubmission","rejectIncompleteSubmission","recordReopenRequest"]},{"objectId":"EvidencePackage","name":"证据包","objectType":"entity","description":"与问题关联的一组附件、回答和诊断信息。","identityPolicy":"evidencePackageId 在支持问题生命周期内稳定。","aggregateRelationship":{"aggregateId":"support_issue","relationshipType":"contained_entity","cardinality":"one_per_support_issue","consistency":"strong_with_aggregate","rationale":"证据包完整性直接影响 SubmitIssue 是否可接受。"},"attributes":["evidencePackageId","attachments","diagnosticAnswers","missingRequiredEvidence","deferredEvidenceReason"],"behaviors":["attachEvidence","markEvidenceDeferred","summarizeReadinessInputs"]},{"objectId":"EvidenceReadiness","name":"证据就绪度","objectType":"value_object","description":"表示证据是否足以进入分诊的就绪结果。","equalityBy":["readinessState","missingRequiredEvidence","deferredEvidenceReason"],"aggregateRelationship":{"aggregateId":"support_issue","relationshipType":"derived_value","cardinality":"recomputed_per_submission_attempt","consistency":"strong_with_aggregate","rationale":"证据就绪度没有独立身份，只作为提交规则判断值。"},"attributes":["readinessState","missingRequiredEvidence","deferredEvidenceReason"],"behaviors":["compareByValue","explainMissingEvidence"]}],"invariants":[{"invariantId":"inv_issue_requires_description","statement":"支持问题提交前必须包含问题描述。","severity":"blocking"},{"invariantId":"inv_reopen_request_requires_resolved_projection","statement":"客户只能在最近可见状态为已解决时发起重新打开请求；是否重新打开支持工单由支持工单上下文处理。","severity":"blocking"}],"lifecycle":["drafted","submitted","accepted_for_support","resolved_visible","reopen_requested"],"consistencyBoundary":"SubmitIssue 和 ReopenIssue 只保护客户受理事实、证据包引用和受理状态；支持工单生命周期通过事件最终一致。","sourceRefs":["flow:submit_issue","prototype:guided-issue-intake.html#review","capability:guided_issue_intake"],"aggregateRoot":"SupportIssue","attributes":["supportIssueId","description","category","intakeStatus","submittedAt","sourceCustomerId"],"behaviors":["submitIssue","requestReopen","evaluateEvidenceReadiness","publishIssueSubmitted","publishIssueReopenRequested"]},{"aggregateId":"support_case","name":"支持工单","contextId":"support_case","domainObjects":[{"objectId":"SupportCase","name":"支持工单","objectType":"aggregate_root","description":"由已提交问题创建、归支持团队负责的生命周期记录。","identityPolicy":"supportCaseId 是支持团队处理生命周期的唯一命令目标。","lifecycleOwnership":"由 support_case 聚合根拥有。","attributes":["supportCaseId","sourceSupportIssueId","caseStatus","currentAssignmentId","resolutionSummary"],"behaviors":["assignOwner","requestEvidence","proposeResolution","reopenCase"]},{"objectId":"CaseAssignment","name":"工单分配","objectType":"entity","description":"当前支持负责人和升级通道。","identityPolicy":"caseAssignmentId 在一次负责人分配期间稳定。","aggregateRelationship":{"aggregateId":"support_case","relationshipType":"contained_entity","cardinality":"zero_or_one_active_assignment","consistency":"strong_with_aggregate","rationale":"负责人和升级通道必须与工单生命周期变更一起保持一致。"},"attributes":["caseAssignmentId","assigneeDisplayName","queueName","assignedAt","nextUpdateWindow"],"behaviors":["replaceAssignee","markEscalationChannel"]}],"invariants":[{"invariantId":"inv_case_tracks_source_issue","statement":"支持工单必须保留来源问题引用。","severity":"blocking"},{"invariantId":"inv_assignment_before_resolution","statement":"支持工单必须有当前负责人后才能提出解决方案。","severity":"blocking"}],"lifecycle":["created","assigned","waiting_for_evidence","in_progress","resolution_proposed","resolved","reopened"],"consistencyBoundary":"SupportCase 保护支持团队处理生命周期、分配、证据请求、解决方案和重新打开接受规则；客户时间线和通知通过事件投射。","sourceRefs":["flow:case_created","flow:surface_status","capability:support_case_lifecycle"],"aggregateRoot":"SupportCase","attributes":["supportCaseId","sourceSupportIssueId","caseStatus","currentAssignmentId","resolutionState","lastVisibleUpdateAt"],"behaviors":["createSupportCase","assignSupportOwner","requestEvidence","proposeResolution","applyReopenDecision"]},{"aggregateId":"sla_policy","name":"SLA 策略","contextId":"policy_sla","domainObjects":[{"objectId":"SlaPolicy","name":"SLA 策略","objectType":"aggregate_root","description":"决定客户可见 SLA、预计更新时间和升级资格的策略规则。","identityPolicy":"slaPolicyId 标识当前生效策略版本。","lifecycleOwnership":"由 sla_policy 聚合根拥有。","attributes":["slaPolicyId","policyVersion","visibilityRules","effectiveFrom"],"behaviors":["evaluateCaseVisibility","selectCustomerSafeFields"]},{"objectId":"VisibilityRule","name":"可见性规则","objectType":"value_object","description":"描述哪些队列、负责人和 SLA 信息可以对客户展示。","equalityBy":["visibleFields","hiddenFields","reasonCode"],"aggregateRelationship":{"aggregateId":"sla_policy","relationshipType":"rule_value","cardinality":"one_or_more_per_policy","consistency":"strong_with_aggregate","rationale":"可见性规则无独立生命周期，随策略版本整体替换。"},"attributes":["visibleFields","hiddenFields","reasonCode"],"behaviors":["compareByValue","applyToTimelineProjection"]}],"invariants":[{"invariantId":"inv_policy_hides_internal_only_fields","statement":"内部队列优先级、人员排班和不可公开策略原因不得直接展示给客户。","severity":"blocking"}],"lifecycle":["active","evaluated","superseded"],"consistencyBoundary":"SlaPolicy 只保护客户可见性和升级资格判断，不修改支持工单生命周期。","sourceRefs":["capability:owner_sla_visibility","prototype:tracking-status.html#owner-sla"],"aggregateRoot":"SlaPolicy","attributes":["slaPolicyId","policyVersion","visibleFields","hiddenFields","escalationEligibility","nextUpdateWindow"],"behaviors":["evaluateSlaVisibility","hideInternalOnlyFields","publishSlaVisibilityEvaluated"]},{"aggregateId":"resolution_feedback","name":"解决反馈","contextId":"support_case","aggregateRoot":"ResolutionFeedback","domainObjects":[{"objectId":"ResolutionFeedback","name":"解决反馈","objectType":"aggregate_root","description":"客户对解决方案是否有效的反馈记录。","identityPolicy":"resolutionFeedbackId 是客户确认或拒绝解决方案的独立命令目标。","lifecycleOwnership":"由 resolution_feedback 聚合根拥有。","attributes":["resolutionFeedbackId","supportCaseId","feedbackState","rating","comment","submittedAt"],"behaviors":["submitFeedback","acceptResolution","rejectResolution","publishResolutionFeedbackSubmitted"]},{"objectId":"FeedbackRating","name":"反馈评分","objectType":"value_object","description":"客户对解决方案体验的评分和值对象。","equalityBy":["score","sentiment","reasonCode"],"attributes":["score","sentiment","reasonCode"],"behaviors":["compareByValue","explainRating"],"aggregateRelationship":{"aggregateId":"resolution_feedback","relationshipType":"rating_value","cardinality":"zero_or_one_rating","consistency":"strong_with_aggregate","rationale":"评分没有独立身份，随解决反馈整体保存。"}}],"invariants":[{"invariantId":"inv_feedback_targets_existing_case","statement":"解决反馈必须引用一个已提出解决方案的支持工单。","severity":"blocking"}],"lifecycle":["pending","submitted","accepted_resolution","rejected_resolution"],"consistencyBoundary":"ResolutionFeedback 只保护客户反馈事实；它通过事件影响 SupportCase，不直接修改工单状态。","at